ref_no,title,tender_value,bid_submission_end_date,emd,bid_open_date
20/EE(E)-II-Hyd/2025-26 (Recall-1),"Renovation of Type-III Quarters-24 nos such as replacement of LED fittings and modular switches etc., and Oil servicing for 400 kVA transformer & VCB panel servicing at EPFO office, Nizamabad. (Electrical Portion)Subwork/Packages:Renovation of Type-III quarters-24 nos such as replacement of LED fittings and modular switches etc., and Oil servicing for 400 kVA transformer & VCB panel servicing at EPFO office, Nizamabad. (Electrical Portion)","₹18,13,376",09/06/2025 16:00,"₹36,268",09/06/2025 16:30
64/2025-26/BD/1,A/R & M/O special scale furniture at 1B Sub Division dg. 2025-26 (SH Providing and fixing modular factory made table office cupboards and dressers in Honorable ministers office at various location),"₹5,70,019",09/06/2025 16:00,"₹11,400",09/06/2025 16:30
08/EE/ODD/NIT/2025-26 RECALL,"EXECUTION OF PLAN FOR RE-DEVELOPMENT / CONSTRUCTION WORK FOR CANARA BANK AT 2/4, WEST PATEL NAAGR, NEW DELHI. (SH- DEMOLISHING OF EXISTING G&1 DISTRESSED/DILAPIDATED AND UNSAFE RCC FRAMED STRUCTURE OLD STAFF QUARTERS I/C DISPOSAL OF UNSERVICEABLE MATERIALS AND CREDITING OF SERVICEABLE MATERIALS). (MODIFIED)Subwork/Packages:SH- DEMOLISHING OF EXISTING G&1 DISTRESSED / DILAPIDATED AND UNSAFE RCC FRAMED STRUCTURE OLD STAFF QAURTERS I/C DISPOSAL OF UNSERVICIEABLE MATERIALS AND CREDITING OF SERVICEABLE MATERIALS (MODIFIED)","₹16,74,509",09/06/2025 16:30,"₹33,490",09/06/2025 17:00
37/EE-II/SD/AE-R/Peo/2025-26,"Ch to contingencies of Construction of Type A School Building staff Quarters T-II 4 Nos, T-III 4 Nos and T-V 1 No including development work and boundary fencing etc i c internal electrical installation fans fire alarm and fire fighting system solar photo voltaic power generation and sub station equipments panels etc for Kendriya Vidyalaya Reckongpeo HP SH Providing services of inspection vehicle along with driver etc complete to officials of CPWD","₹4,46,917",11/06/2025 15:00,"₹8,938",11/06/2025 15:30
09/EE/ODD/NIT/2025-26 RECALL,"EXEUCTION OF PLAN FOR RE-DEVELOPMENT / CONSTRUCTION WORK FOR CANARA BANK AT 26, SOTUH PATEL NAAGR, NEW DELHI. (SH- DEMOLISHING OF EXISTING B & G & 1 DISTRESSED / DILAPIDATED AND UNSAFE RCC FRAMED STRUCTURE OLD STAFF QUARTERS I/C DISPOSAL OF UNSERVICEABLE MATERIALS AND CREDITING OF SERVICEABLE MATERIALS). (MODIFIED).Subwork/Packages:SH- DEMOLISHING OF EXISITNG  B & G &1 DISTRESSED / DILAPIDATED AND UNSAFE RCC FRAMED STRUCTURE ODL STAFF QUARTERS I/C DISPOSAL OF UNSERVICEABLE MATERIALS AND CREDITING OF SERVICEABLE MATERISL. (MODIFIED)","₹13,72,209",09/06/2025 16:30,"₹27,444",09/06/2025 17:00
02/NIT/EE(E)/BFED-I/CPWD/2025-26,"Installation of Yellow LED light on existing poles in place of HPSV light along Indo Bangladesh border from BP No.243/7-S to 750/12-S under Raiganj, Kishanganj and Siliguri sector in West Bengal. (SH:- Providing of Multi- Tasking Services at BFESD-B, CPWD, Balurghat office) during year 2025-26.Subwork/Packages:Providing of Multi-Tasking Services.","₹2,53,440",10/06/2025 15:00,"₹5,069",10/06/2025 15:30
11/EE/ODD/NIT/2025-26,"A/R & M/O OF PHC DISPENSARY, PALAM, NEW DELHI DURING 2025-26.Subwork/Packages:A/R & M/O OF PHC DISPENSARY, PALAM, NEW DELHI DURING 2025-26.","₹7,62,622",09/06/2025 16:30,"₹15,252",09/06/2025 17:00
19/AE-3/II/C2D/2025-26/Chennai,"Providing Bituminous surface over existing damaged old road surface , Construction of new storm water drain, kerb stone repair works of exisiting storm drains in NIS campus Tambaram.SH- Providing false ceiling , grill  work, ACP panelling and miscellaneous works in NIS campus, Tambaram, Chennai -47Subwork/Packages:Providing false ceiling, grill work, ACP panelling and miscellaneous works in NIS campus, Tambaram, Chennai-47","₹4,13,469",05/06/2025 17:00,"₹8,269",05/06/2025 17:30
73/EE(E)/DED-101/2025-26,"RMO Booster and Deep Well Pump Sets at South Block, New Delhi. (SH: Operation of Pumps)","₹19,95,744",09/06/2025 16:20,"₹39,915",09/06/2025 16:30
45/2025-26/DED-102/DELHI/1,"RMO PA, Conference, Car Calling, CCTV, MTV, Intercom & security system at Hyderabad House, New Delhi. (SH:- Providing & Installation of Digital Emergency Calling system at Hyderabad House).","₹5,97,154",09/06/2025 17:00,"₹11,943",09/06/2025 17:30
23/EE(E)-II-Hyd/2025-26,Construction of Eklavya Model Residential School EMRS 28 Nos Residential quarters Principle Residence Type V qtr 1 No Type II Qtrs 10 Nos Type III Qtrs 15 Nos Warden Residence 2 Nos Boys Hostel Gorls Hostel Guest House Kitchen and Dinning ic Development and Bulk Services for EMRS at Tekulapally Badradi Dist Telangana State Phase-II SH Pdg 2 nos of Submersible Borewell pumpsets in the existing borewell along with starters cabling etc and Pdg flood lighting for the volley ball and basket ball courts etc as required.Subwork/Packages:Providing Two nos of Submersible bore well pump sets in the existing bore well along with starters cabling etc and Providing flood lighting for the volley ball and basket ball courts etc as require.,"₹6,78,288",09/06/2025 16:30,"₹13,566",09/06/2025 17:00
02/2025-26/DD(H)/HD-PD(Recall),"Construction of Multi-storied Building at NIEPA Campus, 17- B Aurobindo marg, New Delhi including Water Supply, Sanitary Installation, Electrical Installation, DG Set, Sub- Station, Lifts, HVAC, Fire Fighting System,Fire Alarm, LAN and External Development Work, (Development & maintenance of Horticulture works during 2025-26)","₹15,78,670",09/06/2025 17:00,"₹31,573",09/06/2025 17:30
03/NIT/EE(E)/BFED-I/CPWD/2025-26,"Installation of Yellow LED light on existing poles in place of HPSV light along Indo Bangladesh border from BP No.243/7-S to 750/12-S under Raiganj, kishanganj and Siliguri sector in West Bengal. (SH:- Hiring of Inspection Vehicle (four wheeler) for office of the Assistant Engineer (E), BFESD-B, CPWD, Balurghat during year 2025-26.Subwork/Packages:Hiring of Vehicle","₹5,18,484",10/06/2025 15:30,"₹10,370",10/06/2025 16:00
98/EE/BLY/2024-25 (RECALL),"Construction of boundary wall of animal challenge shed & incinerator at B.P. Division at IVRI, Izatnagar, Bareilly.","₹19,81,224",11/06/2025 10:30,"₹39,624",11/06/2025 11:00
Recall-1 NIT No. 20/EE(E)-I-Hyd./AE(E)-I/II/2025-2026.,"SITC oof Online UPS system with batteries in Technology Bhavan-aldea-TBI Building at NAARM, Rajendranagar, Hyderabad.","₹4,17,786",09/06/2025 16:45,"₹8,356",09/06/2025 17:00
14/EE(E)-I/ Bangalore/2025-26 (1st Recall),"Operation and maintenance of all E and M Services, DRC Buildings at NATGRID, Yelahanka, Bangalore. SH: Replacement/ Repair and one time rectification work of Vertiv make chiller plant.","₹35,73,918",09/06/2025 16:40,"₹71,478",09/06/2025 16:45
43/EE(E)/DED-21/2025-26,"Replacement of Faulty Power Cable and Switchgear at Canteen at CPRTI, New Delhi.","₹3,37,483",09/06/2025 17:00,"₹6,750",09/06/2025 17:30
15/EE/BLY/2025-26(RECALL),"Framing of iron net inside of 48 rooms in 2nd floor and framing of iron net in common room and gym room and other miscellaneous civil works in the Sahilotra hostel at IVRI, Izatnagar, Bareilly. (SH: Repair and renovation work).","₹52,58,661",11/06/2025 10:30,"₹1,05,173",11/06/2025 11:00
20/EE/M-Div/2025-2026,"A/R & M/O various types of Qtrs at Sector-8, R.K. Puram, New Delhi during 2025-2026. (SH: Providing & fixing glazed windows, Flush doors, OHT tanks, loft tanks & FRP doors etc.)","₹29,34,816",12/06/2025 15:00,"₹58,696",12/06/2025 15:30
04/AE/KPSD-2/I/2025-26,"Construction of Composite Block Building and 2 nos Semi Permanent Building associated development works 7 bulk services at NIT Puducherry  Karaikal. SH : Hiring of Inspection Vehicle on monthly basis to karaikal Project Sub Division -2/I & 3/I, CPWD, karaikal for a period of 10 months from 12.06.2025 to 11.04.2026.Subwork/Packages:SH: Hiring of Inspection Vehicle on monthly basis to Karaikal Project Sub Division-2/I & 3/I, CPWD, Karaikal for a period of 10 months from 12.06.2025 to 11.04.2026","₹5,79,955",10/06/2025 15:00,"₹11,600",10/06/2025 15:30
24/EE(E)-II-Hyd/03/CE-Hyd/2025-26,"Maintenance and Upgradation works at IDBI Centre for excellence in banking and Finance (ICBF) Campus, Gachibowli, Hyderabad.Subwork/Packages:Maintenance and Upgradation works at IDBI Centre for excellence in banking and Finance (ICBF) Campus, Gachibowli, Hyderabad","₹4,78,29,532",09/06/2025 17:00,"₹9,56,590",09/06/2025 17:30
22/EE/BLY/2025-26,"Upgradation of old damaged steel windows with Upvc windows for Type-I, II & III residential quarters at Income Tax, Moradabad.","₹46,78,935",11/06/2025 10:30,"₹93,579",11/06/2025 11:00
05/EE/AD/2025-26/1A - Recall 1,A/R & M/O AGCR building dg. 2025-26 (SH: Making Alternate arrangement for urinal and other Misc. work in washrooms).,"₹5,06,605",10/06/2025 15:00,"₹10,132",10/06/2025 15:30
24/EE(E)-I/Bangalore/2025-26,"Replacement of 150 AH, 12V, SMF Batteries for 3 X 80 KVA UPS at NDC DRS, 7th Floor, Kedriya Sadan, Koramangala, Bangalore.","₹15,88,560",09/06/2025 17:00,"₹31,771",09/06/2025 17:05
01/2025-26/AE/CRPF/TORALI,"Construction of 3 Nos 180 Men Barrack at CSJWT for CRPF, Torali, Belgaum. SH : Providing Building layout marking & Soil Investigation for GOs Mess, Administrative Block & Quarter Guard.","₹2,22,200",09/06/2025 15:00,₹0,09/06/2025 15:30
23/EE/BLY/2025-26,"Construction of creach room at Income Tax Office, Moradabad.","₹13,93,210",11/06/2025 10:30,"₹27,864",11/06/2025 11:00
25/EE(E)-I/Bangalore/2025-26,"MOEI and fans, including R/M of WSPS, street lights, UPS, DG set at GRPA Vijayanagar, Bangalore for the year 2025-26.
SH: 1 - Operation and Maintenance of Electrical and Mechanical installations and Pumpsets, street lights at GRPA Vijayanagar, Bangalore.
SH: 2 - Upgradation of various Residential Quarters and supply of day to day consumable materials in GPRA,. Vijayanagar, Bangalore.
SH: 3 - AMC of DG set In GPRA, Vijayanagar, Bangalore.","₹24,81,303",09/06/2025 17:05,"₹49,626",09/06/2025 17:10
31/EE (E)/DED-21/2025-26 - Recall 2,"Providing services for operation & routine maintenance of internal & external electrical installation, compound lighting & security lighting installed at Rajghat, New Delhi. (SH: Providing of trolly mounted diesel pump set on hire basis in Rajghat Samadhi Complex.)","₹21,67,290",09/06/2025 17:29,"₹43,346",09/06/2025 17:30
07/EE(E)/JABALPUR/2025-26 2ND CALL,C/O BUILDING FOR 125MM PSAPDS CCC MANUFACTURING PLANT AND PROCESS CUM STORAGE BUILDING ALONG WITH AC PLANT AND CHANGE ROOMS AT ORDNANCE FACTORY KHAMARIA JABALPURSubwork/Packages:REPLACEMENT OF CONTROLLER OF CHILLER NO 1,"₹7,38,240",10/06/2025 15:00,"₹14,765",10/06/2025 15:30
02/2025-26/AE/CRPF/TORALI,"Construction of 3 Nos. 180 Men Barrack at CSJWT for CRPF, Torali, Belgaum. SH : Providing Building layout marking & level sheet & Earth work Calculation for 02 Nos 180 Men Barracks.","₹91,400",09/06/2025 15:00,₹0,09/06/2025 15:30
Recall 23/EE(E)/DED-11/2025-26/AE(E)-2,"MOEI & Fans, RMO Pumpset at Patiala House Court, New Delhi. (SH: AMC of 03 Nos. 500 LPH RO Plant and repair/replacement of faulty parts)Subwork/Packages:AMC of 03 Nos. 500 LPH RO Plant and repair / replacement of faulty parts","₹4,28,344",09/06/2025 17:30,"₹8,567",09/06/2025 18:00
07/EE(E)/DED-31/2025-26,"RMO E&M Services at Sankhyiki Bhawan in CBD Shahdara, Delhi. (SH: Upgradation of Existing EPABX (UNIFY make) Open Scape Business and HiPath 3800 to Open Scape Business X V3 UC i/c Comprehensive Maintenance of EPABX System Unify make)","₹64,07,291",09/06/2025 17:25,"₹1,28,146",09/06/2025 17:30
18/EE/AIIMSPD-2025-26,"A/R & M/O GPOA Complex INA New Delhi during 2025-26 (SH: Providing Labour for Attending day to day Complaints for B, D and F Block and Miscellaneous Civil Works)","₹67,75,299",09/06/2025 17:30,"₹1,35,506",09/06/2025 18:00
20/2025-26/EE/BLY/I,"Construction of 30 bedded (Expanded to 100 bedded ESIC Hospital Paina Bujurg Sadar, Distt. Shahjhanpur. (UP). (SH: Providing computer operator cum office assistant in the office of Assistant Engineer-I, CPWD, Bareilly).","₹3,60,528",11/06/2025 10:30,"₹7,210",11/06/2025 11:00
67(1)/EE(Puducherry)/AE-V/2025/60,"Contingencies of all works under EE(Puducherry) SH: Providing skilled data entry operator at CPWD Office, JIPMER campus, Karaikal.","₹51,138",10/06/2025 16:00,₹0,
25/EE(E)/PCED/NIT/2025-26,"Operation and maintenance of E & M services, substation, AFAS, Fire fighting & DG sets at NIASM Malegaon, Baramati, Pune. SH: O&M of substation, DG set, AFAS, down comer system & drinking water pump set.","₹31,90,207",10/06/2025 11:00,"₹63,804",10/06/2025 11:30
49/EE/ID/A-2/2025-26,"A/R & M/O work of various bungalows occupied by Supreme Court Judges under2/I Sub-Division during 2025-26 (SH: Roof cleaning, over head tank cleaning, sewer line cleaning & curing of seepage etc.)","₹5,70,742",06/06/2025 15:00,"₹11,415",06/06/2025 15:30
05/SE/DC-1/N-Divn/2025-26,Interior Renovation of Main Building Corridor in UPSC Dholpur House New Delhi. SH: Civil and E&M Works.Subwork/Packages:Civil and E&M Works,"₹1,97,10,642",10/06/2025 15:00,"₹3,94,213",10/06/2025 15:30
13/EE/QDIVN/2025-26,Renovation of 26 Nos toilets in MSIB complex at 35 S P marg New Delhi (SH providing  and fixing cubical partition in running work ) Additional work,"₹18,11,095",24/06/2025 15:00,"₹36,222",24/06/2025 15:30
14/EE/Q Divn/2025-26,Strengthening and repair work of badlay damaged outside wall of 02 nos block (01 to 06 and 07 to 09 ) and various misc. civil work of bapudham residential Qtrs under 2/Q sub division  at San Martin Marg New Delhi 2025-26,"₹25,94,477",24/06/2025 15:00,"₹51,890",24/06/2025 15:30
NIQ03/AE(E)/HCESD-I/IV/2025-26,Operation and Maintenance of Specialized service equipments LT and HT OH lines of 11 KV 315 KVA sub station 2 Nos street lights compound lights 250 KVA DG sets 2 Nos including internal electrical installation water supply pump sets in Residential buildings at NISA CISF Hakimpet Hyderabad SH Providing plug points at Abhimanyu HostelSubwork/Packages:Providing Plug points at Abhimanyu Hostel,₹0,10/06/2025 15:00,₹0,10/06/2025 15:30
05/BPED/2025-26,"Operation and Maintenance of MCH wing at BHU, Varanasi","₹1,48,49,245",11/06/2025 15:00,"₹2,96,985",11/06/2025 15:30
NIQ04/AE(E)/HCESD-I/IV/2025-26,Operation and maintenance of specialized service equipments LT and HT OH lines of 11 KV 315 KVA sub station 2 Nos street lights compound lights 250 KVA DG sets 2 Nos including internal electrical installation water supply pump sets in Residential and Non Residential Buildings at NISA CISF campus Hakimpet Hyderabad SH Providing plug points to Abhaya HostelSubwork/Packages:Providing plug points to Abhaya Hostel,₹0,10/06/2025 15:00,₹0,10/06/2025 15:30
54(6)/LESD-III/2025-26/51,"MOEI & Fans, Pump, Street Light in G.S.I.  Office Building at Aliganj, Lucknow. (SH:-Repairing/servicing of ACs).",₹0,09/06/2025 15:00,₹0,09/06/2025 15:30
33/AE(E)/KCESD-I/KCED-3/CPWD/2025-26,"ARMO of IEI & fans, water pump set, split type AC, Package type AC system, substation, lifts at existing building of STQC Directorate Eastern Regional Test Laboratory( East), at DN-63, Sector-V, Salt Lake City, Kolkata-700091 during FY 2025-26. (SH: Comprehensive maintenance of 1 no. of passenger Kone lift installed at ERTL Campus)","₹1,14,000",10/06/2025 15:00,"₹2,280",10/06/2025 15:30
05/SE/DC-7/PVMD/2025-26,"Upgradation of GPRA Qtrs. at Sector-3 and 7, Pushp Vihar, M.B. Road New Delhi during 2025-26. (Civil and Electrical works).Subwork/Packages:SH:- Civil and Electrical works","₹1,71,24,500",10/06/2025 15:00,"₹3,42,490",10/06/2025 15:30
10/25-26/HYD-III/HYD-Recall,"External  Repair works for Type C Quarters (72 Nos) at NIRDPR Campus, Rajendra Nagar, Hyderabad.","₹9,28,333",09/06/2025 15:00,"₹18,567",09/06/2025 15:30
30/EEE/VBED/2025-26,"Operation and Maintenance of Various EandM Services and Installation during 2025-26 at Udyog Bhawan, New Delhi (SH Repairing of APFC Panel, Allied Electrical Work)","₹13,52,307",10/06/2025 15:00,"₹27,046",10/06/2025 15:30
31/EEE/VBED/2025-26,"Operation and Maintenance of Various EandM Services and Installations during 2025-26 at Nirman Bhawan, New Delhi (SH Servicing and Overhauling of HT, LT Relay and Transformer at Sub-Station)","₹7,31,111",10/06/2025 15:00,"₹14,622",10/06/2025 15:30
12/EE/Jodhpur/2025-26,"A/R & M/O and Special Repair of NSSO Office Building at Sector-14, Udaipur during the year 2025-26Subwork/Packages:A/R & M/O and Special Repair work","₹11,27,379",10/06/2025 14:00,"₹22,548",10/06/2025 14:30
10(7)/NIQ/AE(E)-III/DED-201/2025-26/239,"RMO Electromechanical services at the residence of HMPs Lok Sabha and Rajya Sabha at BKS Marg, Dr. B.D. Marg & DDU Marg, New Delhi. (SH- Supply of Ceiling fan)Subwork/Packages:Supply of Ceiling fan","₹38,479",10/06/2025 15:00,₹770,10/06/2025 15:30
13/EE/Jodhpur/2025-26,A/R & M/O Residential & Non-Residential Buildings and outposts of NTRO at Udaipur during the year 2025-26Subwork/Packages:A/R & M/O Residential  & Non-Residential Building,"₹14,35,533",10/06/2025 14:00,"₹28,711",10/06/2025 14:30
64/AE(E)-II/FESD/2025-26,"Upgradation of existing EI & Fans at Old & New CGO Complex, NH-IV, Faridabad. (SH:- Providing and fixing Simian arrowhead devices.)Subwork/Packages:Providing and fixing Simian arrowhead devices.","₹5,97,700",10/06/2025 15:00,"₹11,954",10/06/2025 15:30
10(7)NIQ/AE(E)-III/DED-201/2025-26/240,"RMO Electromechanical services at the residence of HMPs Lok Sabha and Rajya Sabha at BKS Marg, Dr. B.D. Marg and DDU Marg, New Delhi. (SH-Supply of Chandelier)Subwork/Packages:Supply of Chandelier","₹38,435",10/06/2025 15:00,₹769,10/06/2025 15:30
28/AE(E)-3/DED-301/2025-26/3rd Recall,"Operation and Maintenance of various E&M services at Lokpal Office at Vasant Vihar, New Delhi dg 2025-26 (SH: Repair of Fire Engine & B Check of Fire Engine).Subwork/Packages:Repair of FIre Engine & B check of Fire Engine","₹83,713",10/06/2025 15:00,"₹1,674",10/06/2025 15:30
05/01/SE/EE/NITDD/CPWD/2025-26,"Renovation of ground floor of existing Gents Training Hostel for RLTRI, Gauripur, Bankura West Bengal. SH: Providing attached toilets to all rooms of ground floor including associated civil and electrical services relaying the ground floor with vitrified tiles, refurbishing of existing common toilets, internal painting of ground floor, modification of external sewerage line, external painting of entire building and construction of ramp facility for differently abled personSubwork/Packages:NA","₹1,45,86,932",10/06/2025 15:00,"₹2,91,740",10/06/2025 15:30
58/EE(E)/DED-101/2025-26 - Recall 1,"RMO 7 Nos. Passenger Lifts installed at VP Enclave, New Delhi. (SH: Annual Comprehensive maintenance of lifts.)","₹6,94,116",10/06/2025 15:00,"₹13,882",10/06/2025 15:30
08/2025-26/EE/Kol-I/Kolkata,"A/R & M/O Non-Residential building at 3 No. Govt. Place, Kolkata during 2025-26. SH: Periodical disposal of garbage, building rubbish & day-to-day maintenance and other miscellaneous works.","₹13,86,531",10/06/2025 15:00,"₹27,731",10/06/2025 15:30
19/EE(E)/CPWD/Jaipur/2025-26/AE(E)-I/Recall,Comprehensive maintenance of 08 Passengers and 13 Passenger lifts at different sites located at Jaipur for the F.Y. 2025-26 & 2026-27.,"₹15,80,112",10/06/2025 15:00,"₹31,602",10/06/2025 15:30
37/AE( E)/ KCESDI/KCEDI/CPWD/2025-26,"MOEI and Fans including Compound Light , RMO Motor Pump set, DG Set, Lifts Substation equipments, Wet Riser, Fire alarm at CISF Complex EM Bye pass Kasba Kolkata during 2025-26(SH: Comprehnsive maintenance of AC machine installed at CISF HQ Kasba)","₹3,96,480",10/06/2025 15:00,"₹7,930",10/06/2025 15:30
03/AE-I/03/EE/BFD-VII/2025-26,"Comprehensive maintenance work to IBB Road from IBBR-19A in Murshidabad District of West Bengal during 2025-2026. SH: Providing services of one No. inspection vehicle for office of the Assistant Engineer, Sub-Division-I, BFD-VII, IBBZ-I, CPWD, Cossimbazar, Murshidabad, W.B. for 6(Six) months.Subwork/Packages:Providing services of one No. inspection vehicle for office of the Assistant Engineer, Sub-Division-I, BFD-VII, IBBZ-I, CPWD, Cossimbazar, Murshidabad, W.B. for 6(Six) months.","₹2,68,291",10/06/2025 15:00,"₹5,366",10/06/2025 15:30
34/EE(E)/KCED-3/CPWD/2025-26,"SITC of 40 KVA (2 x20 KVA) online UPS for Computer LAB etc. at NIELIT, Salt Lake, Campus, 35, BF Block, Sec-I, Salt Lake, Kolkata-700064.","₹10,75,402",10/06/2025 15:25,"₹21,508",10/06/2025 15:30
09/NIT/EE/KCD/2025-26 - Recall 2,"Construction of Poultry Shed-2 under AICRP Poultry at ICAR Nagaland Centre, Medziphema, Nagaland.","₹9,32,000",10/06/2025 15:00,"₹18,640",10/06/2025 15:30
34/EE & SM (E)/SCPED/2025-26,MO E&M services at Supreme Court of India New DelhiSubwork/Packages:Comprehensive maintenance of various make VRV/VRF System installed at various location of Administrative Building Complex New Delhi,"₹9,19,296",10/06/2025 15:00,"₹18,386",10/06/2025 15:30
09/2025-26/EE/Kol-I/Kolkata,"Mechanized housekeeping works for day-to-day cleaning of toilets including cleaning of wall & floor tiles of toilet of 1st MSO Building, cleaning of marble at ground floor lift lobby, cleaning of Vitrified tiles at lift lobby of each floor, 4th,5th & 6th floor passage corridoor of 1st MSO Building CPWD Nizam Palace Kolkata during 2025-26.","₹23,99,059",10/06/2025 15:00,"₹47,981",10/06/2025 15:30
09/DD(H)/HDC/CPWD/2025-26,"Landscaping and Development of garden area attached to Indira Gandhi National Forest Academy, FRI under Dehradun Horticulture Sub-Division, DD(Hort.) Chandigarh, CPWD during 2025-26Subwork/Packages:Horticulture work","₹24,17,760",10/06/2025 15:00,"₹48,355",10/06/2025 15:30
33/EE E/DED-61/2025-26,1 RMO VARIOUS ELECTRICAL AND MECHNICAL SERVICES AT NCERT NEW DELHI 2 RMO VARIOUS ELECTRICAL AND MECHANICAL SERVICE AT NIEPA NEW DELHI 3 RMO VARIOUS ELECTRICAL AND MECHANICAL SERVICES AT CIET NEW DELHI SH AMC OF SERVO VOLTAGE STABLIZER,"₹6,74,064",10/06/2025 15:00,"₹13,481",10/06/2025 15:30
19/NIT/EE/AE/AASD-I/2025-26,"AR & MO of Non Residential Office Building of AAD, CPWD, Kahikuchi, Guwahati- 15.","₹5,52,892",10/06/2025 15:00,"₹11,058",10/06/2025 15:30
16/EE (E)/DED-21/2025-26 - Recall 1,"1. Upgradation of existing fire fighting system installed at IP Bhawan, New Delhi. (SH: Supplying & replacement of old/ defective jockey pump set & diesel engine pump set.) 2. Supplying & replacement of old/ defective diesel engine driven main fire pump and fire fighting control panel in AGCR & AGCW & M Building, New Delhi. 3. ARMO/ upgradation of intl. EI & fans, p/sets, lifts, s/stn., DG set, fire fighting, fire alarm, PA System, AC Units & water coolers at IP Bhawan, New Delhi. (SH: Supplying & fixing of PA System.)","₹28,49,920",10/06/2025 14:59,"₹56,998",10/06/2025 15:00
20/EE/Lucknow-I/2025-26,"Outsourcing comprehensive maintenance of civil operations relating to day to day maintenance & special repair etc. of GPRA residential quarters including IEI & fans etc. for Akanksha Parisar, Pocket-B, Jankipuram, Lucknow for 02 Months (2025-26)Subwork/Packages:Outsourcing comprehensive maintenance","₹9,85,065",10/06/2025 15:00,"₹19,701",10/06/2025 15:30
26/AE-4/II/C2D/2025-26/Chennai,"Provision for Raising of base of Chiller Plant Area IMU-HQ, Uthandi, Semmanchery campus, Chennai.Subwork/Packages:Provision for Raising of base of chiller Plant Area IMU-HQ, Uthandi, Semmancherrry campus, Chennai.","₹4,74,703",10/06/2025 15:00,"₹9,494",10/06/2025 15:30
36/AE(E)/KCESD-III/KCED-I/CPWD/2025-26,"MOEI & fans, RMO water pumping sets, of AIIH & PH at 110, C. R. Avenue, Kolkata and Hostel Building at 50, Kolutala Street, Kolkata (SH: Overhauling & servicing of APFC Panel of Transformer-1 & Transformer-2).","₹2,41,715",10/06/2025 15:00,"₹4,834",10/06/2025 15:30
2(3)/AE(E)213/DED-21/2025-26/207 Dt.03/06/2025,"Providing services for operation & maintenance of internal & external electrical installations, compound lighting & security lighting installed at Rajghat New DelhiSubwork/Packages:Providing of 15Hp diesel engine pump sets on hire basis at Rajghat Samadhi",₹0,10/06/2025 15:00,₹0,10/06/2025 15:30
10/2025-26/EE/Kol-I/Kolkata,"A/R & M/O Non-Residential building at 8, K.S.Roy Road, Kolkata during 2025-26. SH: day-to-day civil maintenance at PDA,PAG,LAD and Manager Bunglow.","₹14,66,914",10/06/2025 15:00,"₹29,339",10/06/2025 15:30
26/AE(E)/KCESD-II/KCED-3/CPWD/2025-26/Recall,"MOEI & Fans at CGO Complex, DF Block, Salt Lake, Kolkata during 2025-26(SH: Providing & Fixing Online UPS system at Newly Created Electrical Division Office, KCED-3, 4th Floor, DF Block, Salt Lake, Kolkata-64","₹4,43,911",10/06/2025 15:25,"₹8,878",10/06/2025 15:30
21/EE(C)-I/Vadodara/2025-26,"Providing Aluminium Windows with Granite clading and M.S. Grill of Type-III & Type-IV Residential Quarters of Income Tax Deptt. at Majura Gate, Surat. (SH. Only for Type-III Quarters) during 2025-26.","₹15,81,966",11/06/2025 15:00,"₹31,639",11/06/2025 15:30
63/2025-26/EE-I/AE-II/Shimla,"M/R to DPRA at Bemloe, Chotta Shimla and Park Area during 2025-26. SH:- Repair/Replacement of damaged G.S. sheet roofing & provision of concertina coil fencing for preventing monkey menace at Dundanian (L/F) at Chotta Shimla (H.P.)Subwork/Packages:M/R to DPRA at Bemloe, Chotta Shimla and Park Area during 2025-26. SH:- Repair/replacement of damaged G.S. sheet roofing & provision of concertina coil fencing for preventing monkey menace at Dundanian (L/F) at Chotta Shimla (H.P.)","₹5,53,380",06/06/2025 15:00,"₹11,068",06/06/2025 15:30
03/2025-26/EE/MD,Renovation & repair work in Qtr. No. 01 (Type-VI) in Income Tax colony at Mangal Pandey Nagar Meerut UP.Subwork/Packages:composite work,"₹29,99,782",10/06/2025 15:00,"₹59,996",10/06/2025 15:30
